{
  "$schema": "./performance-lab-matrix.schema.json",
  "contractVersion": "1.0",
  "status": "PLANNED",
  "labRepository": "gecompat/SQL_Server_Lab",
  "minimumLabModuleVersion": "0.1.0",
  "targetVersions": ["2019", "2022", "2025"],
  "providers": ["docker", "podman"],
  "discovery": {
    "include": "Demos/**/manifest.json",
    "excludePrefixes": ["Demos/00_Framework/"],
    "missingCatalogEntry": "FAIL",
    "unknownCatalogEntry": "FAIL"
  },
  "lanes": {
    "SMOKE": {
      "providerMode": "FIRST_AVAILABLE",
      "versions": ["2025"],
      "safetyLevels": ["GREEN"],
      "repetitions": 1
    },
    "CORE": {
      "providerMode": "SELECTED",
      "versions": ["2019", "2022", "2025"],
      "safetyLevels": ["GREEN"],
      "repetitions": 2
    },
    "PROVIDER_PARITY": {
      "providerMode": "ALL",
      "versions": ["2025"],
      "safetyLevels": ["GREEN", "YELLOW"],
      "repetitions": 1,
      "requiresYellowConfirmation": true
    },
    "FULL_CONTAINER_MATRIX": {
      "providerMode": "ALL",
      "versions": ["2019", "2022", "2025"],
      "safetyLevels": ["GREEN", "YELLOW"],
      "repetitions": 2,
      "requiresYellowConfirmation": true
    },
    "RED_DISPOSABLE": {
      "providerMode": "SELECTED",
      "versions": ["2019", "2022", "2025"],
      "safetyLevels": ["RED"],
      "repetitions": 1,
      "requiresRedConfirmation": true
    }
  },
  "demos": [
    {
      "demoId": "QRY-001",
      "manifest": "Demos/05_Query_Patterns/QRY-001_SARGability/manifest.json",
      "implementationStatus": "VALIDATED",
      "safetyLevel": "GREEN",
      "sessions": 1,
      "providers": ["docker", "podman"],
      "versions": ["2019", "2022", "2025"],
      "resourceProfile": "standard",
      "environmentIsolation": "SHARED_PROVIDER_VERSION",
      "requiredCapabilities": ["SQL_DATABASE_ENGINE", "CREATE_DATABASE", "SERVER_STATE"],
      "expectedOutcomes": ["PASS"],
      "defaultRepetitions": 2
    },
    {
      "demoId": "OPT-002",
      "manifest": "Demos/04_Optimizer_Statistics_Plans/OPT-002_Statistics_Anatomy/manifest.json",
      "implementationStatus": "VALIDATED",
      "safetyLevel": "GREEN",
      "sessions": 1,
      "providers": ["docker", "podman"],
      "versions": ["2019", "2022", "2025"],
      "resourceProfile": "standard",
      "environmentIsolation": "SHARED_PROVIDER_VERSION",
      "requiredCapabilities": ["SQL_DATABASE_ENGINE", "CREATE_DATABASE", "SERVER_STATE"],
      "expectedOutcomes": ["PASS"],
      "defaultRepetitions": 2
    },
    {
      "demoId": "CON-004",
      "manifest": "Demos/07_Concurrency/CON-004_Blocking_Chain/manifest.json",
      "implementationStatus": "VALIDATED",
      "safetyLevel": "YELLOW",
      "sessions": 4,
      "providers": ["docker", "podman"],
      "versions": ["2019", "2022", "2025"],
      "resourceProfile": "standard",
      "environmentIsolation": "FRESH_INSTANCE",
      "requiredCapabilities": ["SQL_DATABASE_ENGINE", "CREATE_DATABASE", "SERVER_STATE", "MULTI_SESSION_SQLCMD"],
      "expectedOutcomes": ["PASS"],
      "defaultRepetitions": 2
    },
    {
      "demoId": "OPT-013",
      "manifest": "Demos/04_Optimizer_Statistics_Plans/OPT-013_Controlled_Spill/manifest.json",
      "implementationStatus": "VALIDATED",
      "safetyLevel": "YELLOW",
      "sessions": 1,
      "providers": ["docker", "podman"],
      "versions": ["2019", "2022", "2025"],
      "resourceProfile": "standard",
      "environmentIsolation": "FRESH_INSTANCE",
      "requiredCapabilities": ["SQL_DATABASE_ENGINE", "CREATE_DATABASE", "SERVER_STATE", "TEMPDB_WORKSPACE"],
      "expectedOutcomes": ["PASS"],
      "defaultRepetitions": 2
    },
    {
      "demoId": "OPT-015",
      "manifest": "Demos/04_Optimizer_Statistics_Plans/OPT-015_Plan_Properties/manifest.json",
      "implementationStatus": "VALIDATED",
      "safetyLevel": "GREEN",
      "sessions": 1,
      "providers": ["docker", "podman"],
      "versions": ["2019", "2022", "2025"],
      "resourceProfile": "standard",
      "environmentIsolation": "SHARED_PROVIDER_VERSION",
      "requiredCapabilities": ["SQL_DATABASE_ENGINE", "CREATE_DATABASE", "SERVER_STATE", "LAST_QUERY_PLAN_STATS"],
      "expectedOutcomes": ["PASS"],
      "defaultRepetitions": 2
    },
    {
      "demoId": "OPT-016",
      "manifest": "Demos/04_Optimizer_Statistics_Plans/OPT-016_Rebind_Rewind_Spools/manifest.json",
      "implementationStatus": "VALIDATED",
      "safetyLevel": "GREEN",
      "sessions": 1,
      "providers": ["docker", "podman"],
      "versions": ["2019", "2022", "2025"],
      "resourceProfile": "standard",
      "environmentIsolation": "SHARED_PROVIDER_VERSION",
      "requiredCapabilities": ["SQL_DATABASE_ENGINE", "CREATE_DATABASE", "SERVER_STATE", "LAST_QUERY_PLAN_STATS"],
      "expectedOutcomes": ["PASS"],
      "defaultRepetitions": 2
    },
    {
      "demoId": "QRY-006",
      "manifest": "Demos/05_Query_Patterns/QRY-006_NULL_Semantics/manifest.json",
      "implementationStatus": "IMPLEMENTED",
      "safetyLevel": "GREEN",
      "sessions": 1,
      "providers": ["docker", "podman"],
      "versions": ["2019", "2022", "2025"],
      "resourceProfile": "compact",
      "environmentIsolation": "SHARED_PROVIDER_VERSION",
      "requiredCapabilities": ["SQL_DATABASE_ENGINE", "CREATE_DATABASE"],
      "expectedOutcomes": ["PASS"],
      "defaultRepetitions": 2
    },
    {
      "demoId": "QRY-013",
      "manifest": "Demos/05_Query_Patterns/QRY-013_Client_Session_Context/manifest.json",
      "implementationStatus": "VALIDATED",
      "safetyLevel": "GREEN",
      "sessions": 1,
      "providers": ["docker", "podman"],
      "versions": ["2019", "2022", "2025"],
      "resourceProfile": "standard",
      "environmentIsolation": "SHARED_PROVIDER_VERSION",
      "requiredCapabilities": ["SQL_DATABASE_ENGINE", "CREATE_DATABASE", "SERVER_STATE"],
      "expectedOutcomes": ["PASS", "WARN"],
      "defaultRepetitions": 2
    },
    {
      "demoId": "QRY-004",
      "manifest": "Demos/05_Query_Patterns/QRY-004_Classic_And_Dynamic/manifest.json",
      "implementationStatus": "VALIDATED",
      "safetyLevel": "GREEN",
      "sessions": 1,
      "providers": ["docker", "podman"],
      "versions": ["2019", "2022", "2025"],
      "resourceProfile": "standard",
      "environmentIsolation": "SHARED_PROVIDER_VERSION",
      "requiredCapabilities": ["SQL_DATABASE_ENGINE", "CREATE_DATABASE", "SERVER_STATE"],
      "expectedOutcomes": ["PASS", "WARN"],
      "defaultRepetitions": 2
    },
    {
      "demoId": "OPT-009",
      "manifest": "Demos/04_Optimizer_Statistics_Plans/OPT-009_Parameter_Sensitive_Plans/manifest.json",
      "implementationStatus": "VALIDATED",
      "safetyLevel": "GREEN",
      "sessions": 1,
      "providers": ["docker", "podman"],
      "versions": ["2019", "2022", "2025"],
      "resourceProfile": "standard",
      "environmentIsolation": "SHARED_PROVIDER_VERSION",
      "requiredCapabilities": ["SQL_DATABASE_ENGINE", "CREATE_DATABASE", "SERVER_STATE"],
      "expectedOutcomes": ["PASS", "WARN", "SKIP"],
      "defaultRepetitions": 2
    },
    {
      "demoId": "OPT-010",
      "manifest": "Demos/04_Optimizer_Statistics_Plans/OPT-010_Optional_Parameter_Plans/manifest.json",
      "implementationStatus": "VALIDATED",
      "safetyLevel": "GREEN",
      "sessions": 1,
      "providers": ["docker", "podman"],
      "versions": ["2019", "2022", "2025"],
      "resourceProfile": "standard",
      "environmentIsolation": "SHARED_PROVIDER_VERSION",
      "requiredCapabilities": ["SQL_DATABASE_ENGINE", "CREATE_DATABASE", "SERVER_STATE"],
      "expectedOutcomes": ["PASS", "WARN", "SKIP"],
      "defaultRepetitions": 2
    },
    {
      "demoId": "DGN-003",
      "manifest": "Demos/07_Query_Store_Extended_Events/DGN-003_Query_Store_History/manifest.json",
      "implementationStatus": "VALIDATED",
      "safetyLevel": "GREEN",
      "sessions": 1,
      "providers": ["docker", "podman"],
      "versions": ["2019", "2022", "2025"],
      "resourceProfile": "standard",
      "environmentIsolation": "SHARED_PROVIDER_VERSION",
      "requiredCapabilities": ["SQL_DATABASE_ENGINE", "CREATE_DATABASE", "QUERY_STORE"],
      "expectedOutcomes": ["PASS", "WARN", "SKIP"],
      "defaultRepetitions": 2
    },
    {
      "demoId": "DGN-005",
      "manifest": "Demos/07_Query_Store_Extended_Events/DGN-005_Bounded_Extended_Events/manifest.json",
      "implementationStatus": "VALIDATED",
      "safetyLevel": "YELLOW",
      "sessions": 1,
      "providers": ["docker", "podman"],
      "versions": ["2019", "2022", "2025"],
      "resourceProfile": "standard",
      "environmentIsolation": "FRESH_INSTANCE",
      "requiredCapabilities": ["SQL_DATABASE_ENGINE", "CREATE_DATABASE", "SERVER_STATE", "EXTENDED_EVENTS"],
      "expectedOutcomes": ["PASS", "SKIP"],
      "defaultRepetitions": 2
    },
    {
      "demoId": "OPT-017",
      "manifest": "Demos/04_Optimizer_Statistics_Plans/OPT-017_Parallelism_Skew/manifest.json",
      "implementationStatus": "VALIDATED",
      "safetyLevel": "YELLOW",
      "sessions": 1,
      "providers": ["docker", "podman"],
      "versions": ["2019", "2022", "2025"],
      "resourceProfile": "performance",
      "environmentIsolation": "FRESH_INSTANCE",
      "requiredCapabilities": ["SQL_DATABASE_ENGINE", "CREATE_DATABASE", "SERVER_STATE", "LAST_QUERY_PLAN_STATS", "CPU_4", "MEMORY_8GB"],
      "expectedOutcomes": ["PASS", "WARN", "SKIP"],
      "defaultRepetitions": 2
    },
    {
      "demoId": "OPT-003",
      "manifest": "Demos/04_Optimizer_Statistics_Plans/OPT-003_Sampling_Skew/manifest.json",
      "implementationStatus": "VALIDATED", "safetyLevel": "GREEN", "sessions": 1,
      "providers": ["docker", "podman"], "versions": ["2019", "2022", "2025"],
      "resourceProfile": "standard", "environmentIsolation": "SHARED_PROVIDER_VERSION",
      "requiredCapabilities": ["SQL_DATABASE_ENGINE", "CREATE_DATABASE", "SERVER_STATE"],